
*** Running vivado
    with args -log design_1_AXI_Encoder_0_0.vds -m64 -product Vivado -mode batch -messageDb vivado.pb -notrace -source design_1_AXI_Encoder_0_0.tcl


****** Vivado v2018.3 (64-bit)
  **** SW Build 2405991 on Thu Dec  6 23:38:27 MST 2018
  **** IP Build 2404404 on Fri Dec  7 01:43:56 MST 2018
    ** Copyright 1986-2018 Xilinx, Inc. All Rights Reserved.

source design_1_AXI_Encoder_0_0.tcl -notrace
INFO: [IP_Flow 19-234] Refreshing IP repositories
INFO: [IP_Flow 19-1700] Loaded user IP repository 'd:/FPGA/Vision_Car/EDK-PYNQ-ROBOT/EDK-PYNQ-ROBOT/robotCourse/hw_design/arch/ip'.
INFO: [IP_Flow 19-2313] Loaded Vivado IP repository 'D:/Vivado/Vivado/2018.3/data/ip'.
Command: synth_design -top design_1_AXI_Encoder_0_0 -part xc7z020clg400-1 -mode out_of_context
Starting synth_design
Attempting to get a license for feature 'Synthesis' and/or device 'xc7z020'
INFO: [Common 17-349] Got license for feature 'Synthesis' and/or device 'xc7z020'
INFO: Launching helper process for spawning children vivado processes
INFO: Helper process launched with PID 36696 
---------------------------------------------------------------------------------
Starting RTL Elaboration : Time (s): cpu = 00:00:03 ; elapsed = 00:00:03 . Memory (MB): peak = 472.797 ; gain = 97.656
---------------------------------------------------------------------------------
INFO: [Synth 8-6157] synthesizing module 'design_1_AXI_Encoder_0_0' [d:/FPGA/Vision_Car/EDK-PYNQ-ROBOT/EDK-PYNQ-ROBOT/Car/Car.srcs/sources_1/bd/design_1/ip/design_1_AXI_Encoder_0_0/synth/design_1_AXI_Encoder_0_0.v:57]
INFO: [Synth 8-6157] synthesizing module 'AXI_Encoder_v1_0' [d:/FPGA/Vision_Car/EDK-PYNQ-ROBOT/EDK-PYNQ-ROBOT/Car/Car.srcs/sources_1/bd/design_1/ipshared/8daf/hdl/AXI_Encoder_v1_0.v:4]
	Parameter C_S_AXI_DATA_WIDTH bound to: 32 - type: integer 
	Parameter C_S_AXI_ADDR_WIDTH bound to: 4 - type: integer 
INFO: [Synth 8-6157] synthesizing module 'AXI_Encoder_v1_0_S_AXI' [d:/FPGA/Vision_Car/EDK-PYNQ-ROBOT/EDK-PYNQ-ROBOT/Car/Car.srcs/sources_1/bd/design_1/ipshared/8daf/hdl/AXI_Encoder_v1_0_S_AXI.v:4]
	Parameter C_S_AXI_DATA_WIDTH bound to: 32 - type: integer 
	Parameter C_S_AXI_ADDR_WIDTH bound to: 4 - type: integer 
	Parameter ADDR_LSB bound to: 2 - type: integer 
	Parameter OPT_MEM_ADDR_BITS bound to: 1 - type: integer 
INFO: [Synth 8-226] default block is never used [d:/FPGA/Vision_Car/EDK-PYNQ-ROBOT/EDK-PYNQ-ROBOT/Car/Car.srcs/sources_1/bd/design_1/ipshared/8daf/hdl/AXI_Encoder_v1_0_S_AXI.v:233]
INFO: [Synth 8-226] default block is never used [d:/FPGA/Vision_Car/EDK-PYNQ-ROBOT/EDK-PYNQ-ROBOT/Car/Car.srcs/sources_1/bd/design_1/ipshared/8daf/hdl/AXI_Encoder_v1_0_S_AXI.v:391]
INFO: [Synth 8-6157] synthesizing module 'Encoder' [d:/FPGA/Vision_Car/EDK-PYNQ-ROBOT/EDK-PYNQ-ROBOT/Car/Car.srcs/sources_1/bd/design_1/ipshared/8daf/src/Encoder.v:23]
INFO: [Synth 8-6155] done synthesizing module 'Encoder' (1#1) [d:/FPGA/Vision_Car/EDK-PYNQ-ROBOT/EDK-PYNQ-ROBOT/Car/Car.srcs/sources_1/bd/design_1/ipshared/8daf/src/Encoder.v:23]
WARNING: [Synth 8-689] width (32) of port connection 'clock_per_ms' does not match port width (22) of module 'Encoder' [d:/FPGA/Vision_Car/EDK-PYNQ-ROBOT/EDK-PYNQ-ROBOT/Car/Car.srcs/sources_1/bd/design_1/ipshared/8daf/hdl/AXI_Encoder_v1_0_S_AXI.v:427]
WARNING: [Synth 8-689] width (32) of port connection 'sample_interval' does not match port width (10) of module 'Encoder' [d:/FPGA/Vision_Car/EDK-PYNQ-ROBOT/EDK-PYNQ-ROBOT/Car/Car.srcs/sources_1/bd/design_1/ipshared/8daf/hdl/AXI_Encoder_v1_0_S_AXI.v:428]
WARNING: [Synth 8-689] width (32) of port connection 'dir' does not match port width (1) of module 'Encoder' [d:/FPGA/Vision_Car/EDK-PYNQ-ROBOT/EDK-PYNQ-ROBOT/Car/Car.srcs/sources_1/bd/design_1/ipshared/8daf/hdl/AXI_Encoder_v1_0_S_AXI.v:429]
INFO: [Synth 8-6155] done synthesizing module 'AXI_Encoder_v1_0_S_AXI' (2#1) [d:/FPGA/Vision_Car/EDK-PYNQ-ROBOT/EDK-PYNQ-ROBOT/Car/Car.srcs/sources_1/bd/design_1/ipshared/8daf/hdl/AXI_Encoder_v1_0_S_AXI.v:4]
INFO: [Synth 8-6155] done synthesizing module 'AXI_Encoder_v1_0' (3#1) [d:/FPGA/Vision_Car/EDK-PYNQ-ROBOT/EDK-PYNQ-ROBOT/Car/Car.srcs/sources_1/bd/design_1/ipshared/8daf/hdl/AXI_Encoder_v1_0.v:4]
INFO: [Synth 8-6155] done synthesizing module 'design_1_AXI_Encoder_0_0' (4#1) [d:/FPGA/Vision_Car/EDK-PYNQ-ROBOT/EDK-PYNQ-ROBOT/Car/Car.srcs/sources_1/bd/design_1/ip/design_1_AXI_Encoder_0_0/synth/design_1_AXI_Encoder_0_0.v:57]
WARNING: [Synth 8-3331] design AXI_Encoder_v1_0_S_AXI has unconnected port S_AXI_AWPROT[2]
WARNING: [Synth 8-3331] design AXI_Encoder_v1_0_S_AXI has unconnected port S_AXI_AWPROT[1]
WARNING: [Synth 8-3331] design AXI_Encoder_v1_0_S_AXI has unconnected port S_AXI_AWPROT[0]
WARNING: [Synth 8-3331] design AXI_Encoder_v1_0_S_AXI has unconnected port S_AXI_ARPROT[2]
WARNING: [Synth 8-3331] design AXI_Encoder_v1_0_S_AXI has unconnected port S_AXI_ARPROT[1]
WARNING: [Synth 8-3331] design AXI_Encoder_v1_0_S_AXI has unconnected port S_AXI_ARPROT[0]
---------------------------------------------------------------------------------
Finished RTL Elaboration : Time (s): cpu = 00:00:03 ; elapsed = 00:00:04 . Memory (MB): peak = 528.570 ; gain = 153.430
---------------------------------------------------------------------------------

Report Check Netlist: 
+------+------------------+-------+---------+-------+------------------+
|      |Item              |Errors |Warnings |Status |Description       |
+------+------------------+-------+---------+-------+------------------+
|1     |multi_driven_nets |      0|        0|Passed |Multi driven nets |
+------+------------------+-------+---------+-------+------------------+
---------------------------------------------------------------------------------
Start Handling Custom Attributes
---------------------------------------------------------------------------------
---------------------------------------------------------------------------------
Finished Handling Custom Attributes : Time (s): cpu = 00:00:03 ; elapsed = 00:00:04 . Memory (MB): peak = 528.570 ; gain = 153.430
---------------------------------------------------------------------------------
---------------------------------------------------------------------------------
Finished RTL Optimization Phase 1 : Time (s): cpu = 00:00:03 ; elapsed = 00:00:04 . Memory (MB): peak = 528.570 ; gain = 153.430
---------------------------------------------------------------------------------
INFO: [Device 21-403] Loading part xc7z020clg400-1
INFO: [Project 1-570] Preparing netlist for logic optimization

Processing XDC Constraints
Initializing timing engine
Completed Processing XDC Constraints

Netlist sorting complete. Time (s): cpu = 00:00:00 ; elapsed = 00:00:00 . Memory (MB): peak = 866.449 ; gain = 0.000
INFO: [Project 1-111] Unisim Transformation Summary:
No Unisim elements were transformed.

Netlist sorting complete. Time (s): cpu = 00:00:00 ; elapsed = 00:00:00 . Memory (MB): peak = 866.449 ; gain = 0.000
WARNING: [Constraints 18-5210] No constraints selected for write.
Resolution: This message can indicate that there are no constraints for the design, or it can indicate that the used_in flags are set such that the constraints are ignored. This later case is used when running synth_design to not write synthesis constraints to the resulting checkpoint. Instead, project constraints are read when the synthesized design is opened.
Constraint Validation Runtime : Time (s): cpu = 00:00:00 ; elapsed = 00:00:00.065 . Memory (MB): peak = 869.461 ; gain = 3.012
---------------------------------------------------------------------------------
Finished Constraint Validation : Time (s): cpu = 00:00:10 ; elapsed = 00:00:12 . Memory (MB): peak = 869.461 ; gain = 494.320
---------------------------------------------------------------------------------
---------------------------------------------------------------------------------
Start Loading Part and Timing Information
---------------------------------------------------------------------------------
Loading part: xc7z020clg400-1
---------------------------------------------------------------------------------
Finished Loading Part and Timing Information : Time (s): cpu = 00:00:10 ; elapsed = 00:00:12 . Memory (MB): peak = 869.461 ; gain = 494.320
---------------------------------------------------------------------------------
---------------------------------------------------------------------------------
Start Applying 'set_property' XDC Constraints
---------------------------------------------------------------------------------
---------------------------------------------------------------------------------
Finished applying 'set_property' XDC Constraints : Time (s): cpu = 00:00:10 ; elapsed = 00:00:12 . Memory (MB): peak = 869.461 ; gain = 494.320
---------------------------------------------------------------------------------
INFO: [Synth 8-5818] HDL ADVISOR - The operator resource <adder> is shared. To prevent sharing consider applying a KEEP on the output of the operator [d:/FPGA/Vision_Car/EDK-PYNQ-ROBOT/EDK-PYNQ-ROBOT/Car/Car.srcs/sources_1/bd/design_1/ipshared/8daf/src/Encoder.v:74]
---------------------------------------------------------------------------------
Finished RTL Optimization Phase 2 : Time (s): cpu = 00:00:11 ; elapsed = 00:00:13 . Memory (MB): peak = 869.461 ; gain = 494.320
---------------------------------------------------------------------------------

Report RTL Partitions: 
+-+--------------+------------+----------+
| |RTL Partition |Replication |Instances |
+-+--------------+------------+----------+
+-+--------------+------------+----------+
---------------------------------------------------------------------------------
Start RTL Component Statistics 
---------------------------------------------------------------------------------
Detailed RTL Component Info : 
+---Registers : 
	               32 Bit    Registers := 6     
	                4 Bit    Registers := 2     
	                2 Bit    Registers := 2     
	                1 Bit    Registers := 10    
+---Muxes : 
	   5 Input     32 Bit        Muxes := 1     
	   2 Input     32 Bit        Muxes := 5     
	   4 Input     32 Bit        Muxes := 5     
	   2 Input      1 Bit        Muxes := 7     
---------------------------------------------------------------------------------
Finished RTL Component Statistics 
---------------------------------------------------------------------------------
---------------------------------------------------------------------------------
Start RTL Hierarchical Component Statistics 
---------------------------------------------------------------------------------
Hierarchical RTL Component report 
Module Encoder 
Detailed RTL Component Info : 
+---Registers : 
	               32 Bit    Registers := 1     
	                1 Bit    Registers := 4     
+---Muxes : 
	   5 Input     32 Bit        Muxes := 1     
	   2 Input      1 Bit        Muxes := 2     
Module AXI_Encoder_v1_0_S_AXI 
Detailed RTL Component Info : 
+---Registers : 
	               32 Bit    Registers := 5     
	                4 Bit    Registers := 2     
	                2 Bit    Registers := 2     
	                1 Bit    Registers := 6     
+---Muxes : 
	   2 Input     32 Bit        Muxes := 5     
	   4 Input     32 Bit        Muxes := 5     
	   2 Input      1 Bit        Muxes := 5     
---------------------------------------------------------------------------------
Finished RTL Hierarchical Component Statistics
---------------------------------------------------------------------------------
---------------------------------------------------------------------------------
Start Part Resource Summary
---------------------------------------------------------------------------------
Part Resources:
DSPs: 220 (col length:60)
BRAMs: 280 (col length: RAMB18 60 RAMB36 30)
---------------------------------------------------------------------------------
Finished Part Resource Summary
---------------------------------------------------------------------------------
---------------------------------------------------------------------------------
Start Cross Boundary and Area Optimization
---------------------------------------------------------------------------------
Warning: Parallel synthesis criteria is not met 
DSP Report: Generating DSP inst/AXI_Encoder_v1_0_S_AXI_inst/encoder_inst/rstCounter2, operation Mode is: (C:0xffffffffffff)+(A*B)'.
DSP Report: register inst/AXI_Encoder_v1_0_S_AXI_inst/encoder_inst/RSTVAL_reg is absorbed into DSP inst/AXI_Encoder_v1_0_S_AXI_inst/encoder_inst/rstCounter2.
DSP Report: operator inst/AXI_Encoder_v1_0_S_AXI_inst/encoder_inst/rstCounter2 is absorbed into DSP inst/AXI_Encoder_v1_0_S_AXI_inst/encoder_inst/rstCounter2.
DSP Report: operator inst/AXI_Encoder_v1_0_S_AXI_inst/encoder_inst/RSTVAL0 is absorbed into DSP inst/AXI_Encoder_v1_0_S_AXI_inst/encoder_inst/rstCounter2.
WARNING: [Synth 8-3331] design design_1_AXI_Encoder_0_0 has unconnected port s_axi_awprot[2]
WARNING: [Synth 8-3331] design design_1_AXI_Encoder_0_0 has unconnected port s_axi_awprot[1]
WARNING: [Synth 8-3331] design design_1_AXI_Encoder_0_0 has unconnected port s_axi_awprot[0]
WARNING: [Synth 8-3331] design design_1_AXI_Encoder_0_0 has unconnected port s_axi_arprot[2]
WARNING: [Synth 8-3331] design design_1_AXI_Encoder_0_0 has unconnected port s_axi_arprot[1]
WARNING: [Synth 8-3331] design design_1_AXI_Encoder_0_0 has unconnected port s_axi_arprot[0]
INFO: [Synth 8-3886] merging instance 'inst/AXI_Encoder_v1_0_S_AXI_inst/axi_rresp_reg[0]' (FDRE) to 'inst/AXI_Encoder_v1_0_S_AXI_inst/axi_rresp_reg[1]'
INFO: [Synth 8-3333] propagating constant 0 across sequential element (\inst/AXI_Encoder_v1_0_S_AXI_inst/axi_rresp_reg[1] )
INFO: [Synth 8-3886] merging instance 'inst/AXI_Encoder_v1_0_S_AXI_inst/axi_bresp_reg[0]' (FDRE) to 'inst/AXI_Encoder_v1_0_S_AXI_inst/axi_bresp_reg[1]'
INFO: [Synth 8-3333] propagating constant 0 across sequential element (\inst/AXI_Encoder_v1_0_S_AXI_inst/axi_bresp_reg[1] )
---------------------------------------------------------------------------------
Finished Cross Boundary and Area Optimization : Time (s): cpu = 00:00:11 ; elapsed = 00:00:14 . Memory (MB): peak = 869.461 ; gain = 494.320
---------------------------------------------------------------------------------
---------------------------------------------------------------------------------
Start ROM, RAM, DSP and Shift Register Reporting
---------------------------------------------------------------------------------

DSP: Preliminary Mapping  Report (see note below)
+------------+---------------------------+--------+--------+--------+--------+--------+------+------+------+------+-------+------+------+
|Module Name | DSP Mapping               | A Size | B Size | C Size | D Size | P Size | AREG | BREG | CREG | DREG | ADREG | MREG | PREG | 
+------------+---------------------------+--------+--------+--------+--------+--------+------+------+------+------+-------+------+------+
|Encoder     | (C:0xffffffffffff)+(A*B)' | 22     | 10     | 32     | -      | 32     | 0    | 0    | 0    | -    | -     | 1    | 0    | 
+------------+---------------------------+--------+--------+--------+--------+--------+------+------+------+------+-------+------+------+

Note: The table above is a preliminary report that shows the DSPs inferred at the current stage of the synthesis flow. Some DSP may be reimplemented as non DSP primitives later in the synthesis flow. Multiple instantiated DSPs are reported only once.
---------------------------------------------------------------------------------
Finished ROM, RAM, DSP and Shift Register Reporting
---------------------------------------------------------------------------------

Report RTL Partitions: 
+-+--------------+------------+----------+
| |RTL Partition |Replication |Instances |
+-+--------------+------------+----------+
+-+--------------+------------+----------+
---------------------------------------------------------------------------------
Start Applying XDC Timing Constraints
---------------------------------------------------------------------------------
---------------------------------------------------------------------------------
Finished Applying XDC Timing Constraints : Time (s): cpu = 00:00:22 ; elapsed = 00:00:25 . Memory (MB): peak = 916.789 ; gain = 541.648
---------------------------------------------------------------------------------
---------------------------------------------------------------------------------
Start Timing Optimization
---------------------------------------------------------------------------------
---------------------------------------------------------------------------------
Finished Timing Optimization : Time (s): cpu = 00:00:22 ; elapsed = 00:00:25 . Memory (MB): peak = 917.207 ; gain = 542.066
---------------------------------------------------------------------------------

Report RTL Partitions: 
+-+--------------+------------+----------+
| |RTL Partition |Replication |Instances |
+-+--------------+------------+----------+
+-+--------------+------------+----------+
---------------------------------------------------------------------------------
Start Technology Mapping
---------------------------------------------------------------------------------
---------------------------------------------------------------------------------
Finished Technology Mapping : Time (s): cpu = 00:00:22 ; elapsed = 00:00:25 . Memory (MB): peak = 928.184 ; gain = 553.043
---------------------------------------------------------------------------------

Report RTL Partitions: 
+-+--------------+------------+----------+
| |RTL Partition |Replication |Instances |
+-+--------------+------------+----------+
+-+--------------+------------+----------+
---------------------------------------------------------------------------------
Start IO Insertion
---------------------------------------------------------------------------------
---------------------------------------------------------------------------------
Start Flattening Before IO Insertion
---------------------------------------------------------------------------------
---------------------------------------------------------------------------------
Finished Flattening Before IO Insertion
---------------------------------------------------------------------------------
---------------------------------------------------------------------------------
Start Final Netlist Cleanup
---------------------------------------------------------------------------------
---------------------------------------------------------------------------------
Finished Final Netlist Cleanup
---------------------------------------------------------------------------------
---------------------------------------------------------------------------------
Finished IO Insertion : Time (s): cpu = 00:00:23 ; elapsed = 00:00:26 . Memory (MB): peak = 928.184 ; gain = 553.043
---------------------------------------------------------------------------------

Report Check Netlist: 
+------+------------------+-------+---------+-------+------------------+
|      |Item              |Errors |Warnings |Status |Description       |
+------+------------------+-------+---------+-------+------------------+
|1     |multi_driven_nets |      0|        0|Passed |Multi driven nets |
+------+------------------+-------+---------+-------+------------------+
---------------------------------------------------------------------------------
Start Renaming Generated Instances
---------------------------------------------------------------------------------
---------------------------------------------------------------------------------
Finished Renaming Generated Instances : Time (s): cpu = 00:00:23 ; elapsed = 00:00:26 . Memory (MB): peak = 928.184 ; gain = 553.043
---------------------------------------------------------------------------------

Report RTL Partitions: 
+-+--------------+------------+----------+
| |RTL Partition |Replication |Instances |
+-+--------------+------------+----------+
+-+--------------+------------+----------+
---------------------------------------------------------------------------------
Start Rebuilding User Hierarchy
---------------------------------------------------------------------------------
---------------------------------------------------------------------------------
Finished Rebuilding User Hierarchy : Time (s): cpu = 00:00:23 ; elapsed = 00:00:26 . Memory (MB): peak = 928.184 ; gain = 553.043
---------------------------------------------------------------------------------
---------------------------------------------------------------------------------
Start Renaming Generated Ports
---------------------------------------------------------------------------------
---------------------------------------------------------------------------------
Finished Renaming Generated Ports : Time (s): cpu = 00:00:23 ; elapsed = 00:00:26 . Memory (MB): peak = 928.184 ; gain = 553.043
---------------------------------------------------------------------------------
---------------------------------------------------------------------------------
Start Handling Custom Attributes
---------------------------------------------------------------------------------
---------------------------------------------------------------------------------
Finished Handling Custom Attributes : Time (s): cpu = 00:00:23 ; elapsed = 00:00:26 . Memory (MB): peak = 928.184 ; gain = 553.043
---------------------------------------------------------------------------------
---------------------------------------------------------------------------------
Start Renaming Generated Nets
---------------------------------------------------------------------------------
---------------------------------------------------------------------------------
Finished Renaming Generated Nets : Time (s): cpu = 00:00:23 ; elapsed = 00:00:26 . Memory (MB): peak = 928.184 ; gain = 553.043
---------------------------------------------------------------------------------
---------------------------------------------------------------------------------
Start Writing Synthesis Report
---------------------------------------------------------------------------------

Report BlackBoxes: 
+-+--------------+----------+
| |BlackBox name |Instances |
+-+--------------+----------+
+-+--------------+----------+

Report Cell Usage: 
+------+----------+------+
|      |Cell      |Count |
+------+----------+------+
|1     |CARRY4    |    22|
|2     |DSP48E1_1 |     1|
|3     |LUT1      |     3|
|4     |LUT2      |    10|
|5     |LUT3      |    32|
|6     |LUT4      |    47|
|7     |LUT5      |     4|
|8     |LUT6      |    77|
|9     |FDRE      |   233|
|10    |FDSE      |     1|
+------+----------+------+

Report Instance Areas: 
+------+--------------------------------+-----------------------+------+
|      |Instance                        |Module                 |Cells |
+------+--------------------------------+-----------------------+------+
|1     |top                             |                       |   430|
|2     |  inst                          |AXI_Encoder_v1_0       |   430|
|3     |    AXI_Encoder_v1_0_S_AXI_inst |AXI_Encoder_v1_0_S_AXI |   430|
|4     |      encoder_inst              |Encoder                |   204|
+------+--------------------------------+-----------------------+------+
---------------------------------------------------------------------------------
Finished Writing Synthesis Report : Time (s): cpu = 00:00:23 ; elapsed = 00:00:26 . Memory (MB): peak = 928.184 ; gain = 553.043
---------------------------------------------------------------------------------
Synthesis finished with 0 errors, 0 critical warnings and 6 warnings.
Synthesis Optimization Runtime : Time (s): cpu = 00:00:16 ; elapsed = 00:00:20 . Memory (MB): peak = 928.184 ; gain = 212.152
Synthesis Optimization Complete : Time (s): cpu = 00:00:24 ; elapsed = 00:00:26 . Memory (MB): peak = 928.184 ; gain = 553.043
INFO: [Project 1-571] Translating synthesized netlist
INFO: [Netlist 29-17] Analyzing 23 Unisim elements for replacement
INFO: [Netlist 29-28] Unisim Transformation completed in 0 CPU seconds
INFO: [Project 1-570] Preparing netlist for logic optimization
INFO: [Opt 31-138] Pushed 0 inverter(s) to 0 load pin(s).
Netlist sorting complete. Time (s): cpu = 00:00:00 ; elapsed = 00:00:00 . Memory (MB): peak = 928.184 ; gain = 0.000
INFO: [Project 1-111] Unisim Transformation Summary:
No Unisim elements were transformed.

INFO: [Common 17-83] Releasing license: Synthesis
29 Infos, 16 Warnings, 0 Critical Warnings and 0 Errors encountered.
synth_design completed successfully
synth_design: Time (s): cpu = 00:00:25 ; elapsed = 00:00:28 . Memory (MB): peak = 928.184 ; gain = 564.562
Netlist sorting complete. Time (s): cpu = 00:00:00 ; elapsed = 00:00:00 . Memory (MB): peak = 928.184 ; gain = 0.000
WARNING: [Constraints 18-5210] No constraints selected for write.
Resolution: This message can indicate that there are no constraints for the design, or it can indicate that the used_in flags are set such that the constraints are ignored. This later case is used when running synth_design to not write synthesis constraints to the resulting checkpoint. Instead, project constraints are read when the synthesized design is opened.
INFO: [Common 17-1381] The checkpoint 'D:/FPGA/Vision_Car/EDK-PYNQ-ROBOT/EDK-PYNQ-ROBOT/Car/Car.runs/design_1_AXI_Encoder_0_0_synth_1/design_1_AXI_Encoder_0_0.dcp' has been generated.
INFO: [Coretcl 2-1648] Added synthesis output to IP cache for IP design_1_AXI_Encoder_0_0, cache-ID = 892e5d2a0445a515
INFO: [Coretcl 2-1174] Renamed 3 cell refs.
Netlist sorting complete. Time (s): cpu = 00:00:00 ; elapsed = 00:00:00 . Memory (MB): peak = 928.184 ; gain = 0.000
WARNING: [Constraints 18-5210] No constraints selected for write.
Resolution: This message can indicate that there are no constraints for the design, or it can indicate that the used_in flags are set such that the constraints are ignored. This later case is used when running synth_design to not write synthesis constraints to the resulting checkpoint. Instead, project constraints are read when the synthesized design is opened.
INFO: [Common 17-1381] The checkpoint 'D:/FPGA/Vision_Car/EDK-PYNQ-ROBOT/EDK-PYNQ-ROBOT/Car/Car.runs/design_1_AXI_Encoder_0_0_synth_1/design_1_AXI_Encoder_0_0.dcp' has been generated.
INFO: [runtcl-4] Executing : report_utilization -file design_1_AXI_Encoder_0_0_utilization_synth.rpt -pb design_1_AXI_Encoder_0_0_utilization_synth.pb
INFO: [Common 17-206] Exiting Vivado at Fri Dec 26 23:12:06 2025...
